{
  "schema_version": "1",
  "timestamp": 1724050000000000002,
  "session_id": "sess-777",
  "client_process": "codex-cli",
  "server_host": "localhost",
  "server_port": 8080,
  "tls": false,
  "method": "tools.exec",
  "request_bytes": 256,
  "response_bytes": 128,
  "tool_invoke_count": 1,
  "file_access_count": 0
}

