{
  "schema_version": "1",
  "timestamp": 1724050000000000001,
  "session_id": "sess-999",
  "client_process": "claude-code",
  "server_host": "unknown.example.com",
  "server_port": 443,
  "tls": true,
  "method": "prompts.get",
  "request_bytes": 1024,
  "response_bytes": 4096,
  "tool_invoke_count": 1,
  "file_access_count": 0
}

